id,love,joy,surprise,anger,sadness,fear,comment
1002038_2,,,,,,,Reopen if I'm mistaken.
1712997_1,,,,,,,We have an HTTP discovery agent in activemq-http no other activity on this issue so closing for now.
823209_2,,,,,,,Although the older patch applied fine for me (patch -p1).
2402199_1,,x,,,,,This is a great suggestion.
2402199_2,,,,,,,jBPM already works this way.
623487_1,,,,,,,Thanks Amar!
1573728_1,,,,,,,Would your use case be covered by adding a TTL to CF?
1573728_2,,,,,,,Because that seems like the natural level of granularity for this to me.
2505559_2,,,,,,,Looks like Forge isn't used at companies having a firewall.
567798_1,,,,,,,Attached patch for Myfaces.
1613607_1,,,,,,,"the  repairment to BlueSky official website Downloads.html and MailingLists.html

thebluesky group an use the patch freely"
774797_1,,,,,,,"adding --rsyncable to our build system, does not seem to be a big task, I am experimenting with it."
774797_2,,,,,,,"seen from my chair, this is a very elegant solution, until we can really split our distribution into smaller files (exe + langauge packs) and have a meta installer that combines what the user want.
"
1144560_1,,,,,,,Regenerated patch with trunk and with an indentation change.
1876181_1,,,,,,,Spoke too soon!
1876181_2,,,,,,,The SocetException is still there sporadically.
1016257_1,,,,,,,This adds testing of the RegionSplitsTracker.
874025_1,,,,,,,I committed the patch to trunk.
874025_2,,,,,,,Thank you Ivan!
874025_3,,,,,,,Thanks Daryn for the review.
1079117_1,,,,,,,"If possible, let's schedule to 0.4"
304778_1,,,,,,,"Whoops, yeah, sorry."
402189_1,,,,,,,"Agreed, wildcards (*, ?)"
402189_2,,,,,,,"are enough for this, rather than full blown regexp."
402189_3,,,,,,,It's also easier then to tell a wildcard-based config from a normal one.
1503751_1,,,,,,,Feature verification is completed including Upgrade.
1503751_2,,,,,,,hence closing the ticket.
1422107_1,,,,,,,This issue is being tracked by other JIRAs now.
813473_1,,,,,,,RB at https://reviews.apache.org/r/15607/
1678213_1,,,,,,,I just committed this.
1678213_2,,,,,,,"Thanks, Scott!"
1886471_1,,,,,,,Sonar does not use JavaNCSS at all !
879312_1,,,,,,,The 0.23 patch looks fine.
879312_2,,,,,,,I also tried to resolve merge conflicts and ended up with pretty much the same patch as yours.
879312_3,,,,,,,The only significant code difference seems to be in getBlockLocations().
1478633_1,,,,,,,Thanks for the patch.
1478633_2,,,,,,,It was applied with minor changes in 2.1.10-dev and 2.2-dev.
1478633_3,,,,,,,Please reopen the issue if needed.
2167248_1,,,,,,,fixed in 1.8. checking in javadoc fixes momentarily
2325805_1,,,,,,,Committed in r14473 on trunk and r14474 on 2.0.x.
449674_1,,,,,,,I know this hasn't been looked at in quite a while.
449674_2,,,,,,,I can't see the current GOP and GKOP being completely replaced but there may well be some areas where your code could be incorporated.
449674_3,,,,,,,It would help considerably if you could explain what the problem was/is with finite sized pools and the current implementation.
449674_4,,,,,,,"Without an explanation of what the issue is, this issue is likely to remain dormant or just be closed as won't fix."
1433090_1,,,,,,,"Same in problem in SQLServer, solved with catalog=null and schema=""%"""
2248369_1,,,,,,,Done as part of Felix resolver integration
508220_1,,,,,,,Latest commits now include filemgr and workflowmgr integration.
508220_2,,,,,,,The work in progress archetype is now committed in the trunk (http://svn.apache.org/repos/asf/oodt/trunk/mvn/archetypes/radix/).
1112403_1,,,,,,,"Bharath,

Since all of this work's goal was done - can this be closed?"
2276054_1,,,,,,,"Thanks for Paul King's advice, I tried 1.6.3 again with groovy.bat."
2276054_2,,,,,,,"groovy.bat don't have this problem, so the problem is from the native launcher."
1472345_1,,,,,,,Closing as dupe.
354179_1,,x,,,,,"great, thanks Joel."
2512266_1,,,,,,,"Marek Novotny <mnovotny@redhat.com> made a comment on [bug 883918|https://bugzilla.redhat.com/show_bug.cgi?id=883918]

This will be fixed/upgraded to GWT 2.5 in WFK 2.3."
562642_1,,,,,,,"Per Doğacan's comment, we need to reopen this and test out his new patch for it."
562642_2,,,,,,,"Andrzej, I'd be happy if you reassigned to you, however, I will have some time on Tuesday to look at this if you don't until then."
1210080_1,,,,,,,latest from RB
397947_1,,,,,,,"commit fix
http://svn.apache.org/viewvc?rev=729857&view=rev to nmr project
http://svn.apache.org/viewvc?rev=729894&view=rev to features project"
437102_1,,,,,,,"Robbie,

Could you please review and commit the patch?"
1477180_1,,,,,,,"Hmm, it did work on monday for me; strange, I'll have a look at it right now"
1648070_1,,,,,,,reviewed and committed patch.
1648070_2,,,,,,,Thanks Charitha.
2178588_1,,,,,,,"Added to portletswap, but not the distro until we have themed groupings."
1593075_1,,,,,,,Thanks for reporting.
1593075_2,,,,,,,Yeah classloading in JBoss is a bit tricky :)
205810_1,,x,,,,,"Thanks for reporting, solved!"
1945698_1,,,,,,,Applied slightly modified patch in [r18180|http://fisheye.codehaus.org/changelog/mojo/?cs=18180].
1945698_2,,,,,,,Thanks!
817949_1,,,,,,,[~ashutoshc] Thanks.
938924_1,,,,,,,The rpc changes look good to me in the patch (smile)
1465991_1,,,,,,,I will rewrite that part.
2134187_1,,,,,,,"Scratch that, this fails horribly after the change to unparsing negative numbers as hex."
2334381_1,,,,,,,Fixed in next savara release.
1647861_1,,,,,,,Some more work towards full SAAJ 1.3 implementation.
929227_1,,,,,,,Patch for 0.96 corresponding to latest trunk patch.
286038_1,,x,,,,,it belongs to faces 1.2 :)
520700_1,,,,,,,"Thanks Amit,

Your patch is in trunk at r832776, R9.04 r832779
"
1413572_1,,,,,,,"We decided not to support jdk13 jvms with 10.3, so there's no point in attempting to change anything at this point."
693792_1,,,,,,,OK thanks for the review guys!
693792_2,,,,,,,I'll commit soon.
1210099_1,,,,,,,Patch committed.
580709_1,,x,,,,,"Ok cool, this is just a matter of adding strings to the various [NotFound()|https://github.com/apache/mesos/blob/0.15.0-rc4/src/files/files.cpp#L160] returns in files.cpp

There are a number of error cases in the [browse|https://github.com/apache/mesos/blob/0.15.0-rc4/src/files/files.cpp#L204] and [read|https://github.com/apache/mesos/blob/0.15.0-rc4/src/files/files.cpp#L204] endpoints, I'd imagine one could change the javascript to generate bad requests which should be sufficient to test this :)"
1210099_2,,,,,,,Thanks Hari!
741066_1,,,,,,,Ping?
741066_2,,,,,,,Did you manage to create a test program?
741066_3,,,,,,,It looks like there is an unencodable character.
2547124_1,,,,,,,JMX support will be implemented with the remoting project.
545539_1,,x,,,,,"cool, no worries."
2269259_1,,,,,,,As of the new log4j DSL this is not an issue
1865359_1,,,,,,,Tested by submitter.
1149665_1,,,,,,,I just committed this.
1149665_2,,,,,,,"Thanks, Amar - this was a long-drawn affair!"
717914_1,,,,,,,Fixed for exclusion: http://svn.apache.org/viewvc?view=revision&revision=1539249
288955_1,,,,,,,"Hi

Thanks for your help testing this stuff."
288955_2,,,,,,,I did a review and I found the problem is not on tomahawk.
288955_3,,,,,,,Really it is a side effect of the browser (IE 7 and IE 8).
288955_4,,,,,,,"In few words, onchange event is not published until the checkbox lost focus."
288955_6,,,,,,,"I'll close this issue as won't fix, but anyway I commit the fix on tomahawk examples."
310347_1,,,,,,,89 and 90 look fine.
376257_1,,x,,,,,"Cool feature!

Performance:
 - It looks like scripts are read from the resource loader and parsed again (eval) for every update request."
2116246_1,,,,,,,"Yes, this was fixed through Yecht."
2375072_1,,,,,,,"Should be fixed with DOXIA-390, I added your test case."
2375072_2,,,,,,,Thanks!
52899_1,,,,,,,all history lost?
52899_2,,,,,,,"for example:
https://github.com/hibernate/hibernate-core/commits/3.6/hibernate-testsuite/pom.xml
https://github.com/hibernate/hibernate-core/commits/3.6/testsuite/pom.xml"
420205_1,,,,,,,Review board: https://reviews.apache.org/r/15335/
1131871_1,,,,,,,I just committed this.
1131871_2,,,,,,,"Thanks, Amar!"
1447417_1,,,,,,,patch reviewed and applied by Eoghan with r502283
1473434_1,,,,,,,Extra javadoc added
260556_1,,x,,,,,"Thanks Ram,

That seems like a definite improvement."
260556_2,,x,,,,,Interesting that you decided not to detect the error based on finding two similarly-named operations.
260556_3,,,,,,,"I wonder if there are any advantages to your way of doing it over mine, but I think yours will definitely work to detect the error cases I had in mine.

"
1556724_1,,,,,,,Fair enough.
705725_1,,,,,,,"Hello Bhumir,

I think Ivan is right - can you try to test your case with the complete version of log4php, not only the files I have mentioned."
705725_2,,,,,,,Thanks for you patience - this is a nasty issue.
705725_3,,,,,,,"Cheers
Christian"
1947696_1,,,,,,,committed r1296706.
1048920_1,,,,,,,"both patches applied, looks good."
2333436_1,,,,,,,This never got into Indigo - pusihing for it to go into Juno.
2255647_1,,,,,,,I'm not convinced making GrailsApplication serializable is a good idea.
2255647_2,,,,,,,"You ""workaround"" of making it transient is the correct solution. "
1544053_1,,,,,,,"It applies, thanks."
1009987_1,,,,,,,TestMultiColumnScanner has been committed to trunk.
2110473_1,,,,,,,it is fixed by r1358 in jbossweb  2.1.x.
1415518_1,,,,,,,Unsetting Fix Version on unassigned issues.
1563950_1,,,,,,,"Excellent, the performance is much better."
1563950_2,,,,,,,Committed.
677469_1,,,,,,,Bulk close for 3.1
1936386_1,,,,,,,"[~lfryc], [~bleathem], [~ppitonak]
Do you think guys that those page fragments methods which depend on JSON parsing - aka various {{setupFromWidget}} should throw {{UnsupportedOperationException}} till this issue is resolved ?"
1936386_2,,,,,,,"IMHO not, as we can quite quickly implement this, right ?"
1586131_1,,,,,,,Applied patch with thanks to Oliver.
383828_1,,,,,,,Bulk close for Solr 1.4
803094_1,,,,,,,"Hi Oleg

Would you be able to review this one?"
803094_2,,,,,,,"thanks
asankha"
2385607_1,,,,,,,"Yeah, this was a word which somebody had looked up in Dacco."
2385607_2,,,,,,,I saw 'acusament de recepció' in the GDLC but I wasn't certain what it was in English.
2385607_3,,,,,,,Perhaps 'acknowledgement slip' would be the most commonly used term in English?
1434805_1,,,,,,,"Applied the same fix as in issue 25001

http://cvs.apache.org/viewcvs.cgi/jakarta-commons/dbcp/src/java/org/apache/commons/dbcp/datasources/PerUserPoolDataSource.java?r1=1.10&r2=1.11&diff_format=h
"
1343673_1,,,,,,,Postponed to 2.0.0-RC1
1918526_1,,,,,,,fixed by Shane.
2268310_1,,,,,,,"Steve, can you clarify?"
2268310_2,,,,,,,I'm not seeing how including a dependency would alter the fundamental behavior of createLink() and createLinkTo() requiring a request object.
816711_1,,,,,,,Here are my thoughts about how it can be approached.
855337_1,,,,,,,"Fine with me.
"
2226346_1,,,,,,,On the recommendation of Weinan
2127485_1,,,,,,,Resolved in commit 5260 (patch by Vladimir Sizikov)
1615699_1,,,,,,,Patch submitted.
1615699_2,,,,,,,Please review.
1615699_3,,,,,,,Thank you.
1618006_1,,,,,,,I filed bug # 42715 with ASF Bugzilla about the ant.version issue.
426446_1,,,,,,,Seems fine to me.
578535_1,,,,,,,Thanks for looking after this.
578535_2,,,,,,,I will be working to integrate this when I am back in CA.
980981_1,,,,,,,Thanks Andy.
980981_2,,,,,,,Added as a subtask [HBASE-6157] to this parent jira.
980981_3,,,,,,,Hope that should be fine.
478251_1,,,,,,,I added the PDType1CFont patch in revision 1425301
1807502_1,,,,,,,Clocked asyncs are fixed in r19148.
485706_1,,,,,,,"Since we will have another RC, we decided to include this change in 1.5.2."
1125728_1,,,,,,,Attaching patch which incorporates Hemanth's comments.
1883953_1,,,,,,,Documentation is still a bit lacking
1799586_1,,,,,,,Don't absue the ticketing system
668048_1,,,,,,,I committed {{BasicFunctionalityTest.testHTMLStrip()}} to branch_3x - it succeeds for me with no changes required.
2165641_1,,,,,,,The per invocation timeout facility has been added for the rmi and sslrmi transports.
2165641_2,,,,,,,Unit test: org.jboss.test.remoting.transport.rmi.timeout.RMIPerInvocationTimeoutTestCase.
2540286_1,,,,,,,Thanks for the answer Mohammad wrk.
2540286_2,,,,,,,Indeed this saved some time.
887367_1,,,,,,,"Looks like this was fixed in HDFS-3966 (For branch-1, TestFileCreation should use JUnit4 to make assumeTrue work)."
893309_1,,,,,,,"I'm envisioning something like `hdfs dfsadmin -fetchimage <local path>' which would use the existing GetImageServlet to download the fsimage over HTTP, saving it at <local path>."
2131161_1,,,,,,,I'm kinda dissapointed.
2131161_2,,,,,,,I'm using jruby.bat from jruby 0.9 and it works fine.
248476_1,,,,,,,applied Marnix's patch to trunk.
1506060_2,,,,,,,"url: https://192.168.124.100/sdk/vimService, username: Administrator, password: C******"
2277641_1,,,,,,,"Note, this used to work fine in 2.7, looking at ""git blame"" output it would seem the regression happened as Niels added support for 3D bboxes"
1607244_1,,,,,,,patch looks good.
1607244_2,,,,,,,+1 thanks Ivan.
456364_2,,,,,,,"Koji Noguchi, I think this was fixed."
456364_3,,,,,,,I don't see the issue on trunk.
456364_4,,,,,,,Just realize that.
456364_5,,,,,,,Thanks!
456364_6,,,,,,,Can you show me which jira fixed this?
456364_7,,,,,,,I should have tested with trunk before creating this jira.
456364_8,,,,,,,I think I even tried with pig-0.11 to confirm the problem.
1678217_1,,,,,,,I'm sorry for the confusion.
2036173_1,,,,,,,Thanks Ittay.
2036173_2,,,,,,,"Can you provide a little more context on this please... 

1."
2036173_3,,,,,,,Under what runtime conditions are you seeing this.?
2036173_5,,,,,,,2
2036173_6,,,,,,,Would you have a test that we can use to reproduce?
1050624_1,,,,,,,Verified.
1050624_2,,x,,,,,It's OK.
1050624_3,,,,,,,Thanks very much!
1132629_1,,,,,,,The -branch-18 patch does not apply to Hadoop 0.18.3.
1132629_3,,,,,,,"The only definitions of ""OutputStream baseStream"" are in run(), copyBlock(), and readBlock()."
1132629_5,,,,,,,"Raghu, am I correct here?"
1723915_1,,,,,,,Resolving the issue as the patch was applied to Airavata trunk.
658099_1,,,,,,,"I see FilteringTokenFilter has a similar first token pos incr fixup, so this problem is handled in at least one other filter."
658099_2,,,,,,,"I'll take a broader look tomorrow.
"
527415_1,,,,,,,"Jacques, if you create separate issues for the erros (icluding the logs) I can take a look them."
527415_2,,,,,,,Thanks for your vote.
527415_3,,,,,,,Any other opinions about the patch?
1720530_1,,,,,,,+1 for the patch.
1720530_2,,,,,,,Committed to trunk.
1720530_3,,,,,,,Thanks Arpit!
1191390_1,,,,,,,I think your logic is right.
1191390_2,,,,,,,This is what I understand.
1191390_3,,,,,,,1
1191390_4,,,,,,,FileSystemView is the user file system view so it can have canDelete() and canRead() methods ..... this is fine.
1191390_5,,,,,,,2
1191390_6,,,,,,,FileSystemView can have user object to indicate whose file system view it is representing.
1191390_7,,,,,,,3
1191390_8,,,,,,,"In that case, caching will be at the FileSystemView level (not at FileObject level)."
1191390_9,,,,,,,Logically this is also fine.
1191390_10,,,,,,,NativeFileSystemView represents the underlying OS file system view - no more no less.
1191390_11,,,,,,,Caching is a specialized function.
1191390_12,,,,,,,So if necessary we can add another FileSystemManager implementation which will support caching.
1191390_13,,,,,,,But it may not be appropriate to add this in NativeFileSystem classes.
1191390_14,,,,,,,"So the action items:
1. canDelete(), canRead() and canWrite() will be moved to FileSystemView from FileObject.
 "
1830169_1,,,,,,,Please review and close out if appropriate.
1043193_1,,,,,,,This issue has been fixed by the Harmony-5834.
1043193_2,,,,,,,The testcase is helpful for ArrayList.
1043193_3,,,,,,,Thanks very much for the contribution.
1043193_4,,,,,,,The fixing is available in all builds after r658561.
587137_1,,,,,,,solved in subversion repository as of r818942.
587137_2,,,,,,,"patch applied with slight changes
thanks for the report and thanks for the patch"
942679_1,,,,,,,Thanks for the patch Gustavo.
942679_2,,,,,,,I applied to 0.95 and trunk.
1821302_1,,,,,,,I thought there was already a (Hibernate specific?)
1821302_3,,,,,,,"Some property which points to a ""DDL file""."
1821302_4,,,,,,,"It might have meant to create a DB schema, but perhaps you can just use it to do whatever migration activity that you are looking for?
"
1680193_1,,,,,,,"Please apply the attached patch by doing the following:

1."
1680193_2,,,,,,,"Add the new file modules\java2wsdl\src\test\java\org\apache\tuscany\tools\java2wsdl\generate\ExampleService.java
2."
1680193_3,,,,,,,"Apply the changes in patch1658
3."
1680193_4,,,,,,,"Unzip ws-void-args-return under the itest directory
4."
1680193_5,,,,,,,"Update the pom for itest to include ws-void-args-return

This patch fixes TUSCANY-1658 and TUSCANY-1653, and add an itest to verify the fix."
1680193_6,,,,,,,It also includes a corresponding change in java2wsdl to handle the two-way void return case correctly.
1659339_1,,,,,,,Applied patch.
1659339_2,,,,,,,Thanks!
854145_1,,,,,,,"+1, looks good.
"
1025268_1,,,,,,,"One final note, the error handling should have its own JIRA so that it is addressed one day?"
1025268_2,,,,,,,"Oh, and that wiki page for the shell is slightly formatted wrong by the looks, it changes to cursive/italics and stays until the end."
1025268_3,,,,,,,And the .irbrc sample output has no line breaks and makes it difficult to read it.
877499_2,,,,,,,Fix race conditions in Balancer.
877499_3,,,,,,,"Contributed by Junping Du (szetszwo: http://svn.apache.org/viewcvs.cgi/?root=Apache-SVN&view=rev&rev=1532932)
* /hadoop/common/trunk/hadoop-hdfs-project/hadoop-hdfs/CHANGES.txt
* /hadoop/common/trunk/hadoop-hdfs-project/hadoop-hdfs/src/main/java/org/apache/hadoop/hdfs/server/balancer/Balancer.java
"
2065257_1,,,,,,,Applied the patch to implement Workspace.move
234857_1,,,,,,,We pretty much already had the interface we wanted for this (IFixedLocationResourceStream).
234857_2,,,,,,,I only needed to let MarkupResourceStream also implement it.
234857_3,,,,,,,"And then MarkupCache uses that interface to checkout what the actual file is

I dont think we will get IResourceStream implementation that are not File or URL and if we do then we fallback on the cachekey only approache."
234857_4,,,,,,,"It seems to work fine for me when i test locally, the markup is only created once per fixed location and then access through

cachekey -> locationstring -> markup

So if locationString doesn't work we get this:

cachekey -> cachekey -> markup

But i guess that is a very small percentage if there is even 1 on this planet...

should we include this into 1.3.2?"
1049100_1,,,,,,,Thanks Tatyana - the third patch was applied to BTI branch 2.0 at r552655.
1049100_2,,,,,,,Please check that the patch was applied as you expected and close the issue if everything is OK for you.
1899200_1,,,,,,,"Sebastian, as Sonar calls the cobertura maven plugin there is not much we can do."
1899200_2,,,,,,,"Until the patch gets applied, you might want to use Emma as coverage engine with the Sonar Emma Plugin (or Clover, but it is free only for a month)"
2146300_1,,,,,,,"Hi Matt,

Encrypting the serialized component tree will not solve the problem of stale view state."
2146300_2,,,,,,,The Sun JSF-RI team have implemented a fix for this issue.
2146300_3,,,,,,,It will be available in 1.2_05.
2146300_4,,,,,,,"See the following link for more info:

https://javaserverfaces.dev.java.net/issues/show_bug.cgi?id=612

Thanks,
Ian"
1863393_1,,,,,,,the configuration in the POM works fine with 2.4.3.
2323091_1,,,,,,,"Patch applied on 2.1.x, 2.2.x and trunk"
385042_1,,,,,,,"Just an update:

# SOLR-1131: aka poly fields is almost ready to go."
385042_2,,,,,,,Please review.
385042_3,,,,,,,# SOLR-1297: sort by function query just needs review and then can be committed.
385042_4,,,,,,,"After that, we can add in the Cartesian Tier indexing and the Cartesian Tier QParserPlugin (after a little re-write)."
385042_5,,,,,,,Then we need pseudo-fields and we likely  want to hook in a per request function cache (maybe)
1423534_1,,x,,,,,"Hi Suran,

The new catalogs_b.patch looks very good."
1423534_2,,,,,,,It will need another round or two of adjusting but it is definitely looking solid.
1423534_3,,,,,,,I have applied the patch and am running regression tests now.
1423534_4,,,,,,,I will post my results when the tests finish.
1423534_5,,,,,,,"I have some comments on the new patch:

PermDescriptor

o You should remove the permUUID field from this class since it shadows the oid field in the superclass."
1423534_6,,,,,,,"In my experience, this kind of shadowing always causes bugs in the future because it is so easy to lose track of which copy of the redundant field is being used."
1423534_7,,,,,,,"So the constructor for this class should call setUUID( permUUID ) rather than stuffing the shadowing field via ""this.permUUID = permUUID""."
1423534_8,,,,,,,"o Once you do that, you can get rid of the getUUID(), setUUID(), and getObjectID() methods in this class."
1423534_9,,,,,,,o I have reservations about the second constructor for this class (the one which is used to create a key descriptor rather than a full-fledged permissions descriptor).
1423534_10,,,,,,,"However, I see that you are following the data dictionary patterns for the other permissions descriptors."
1423534_11,,,,,,,I think you are right to follow the existing patterns.
1423534_12,,,,,,,But we should put a sticky note on our brains to remind ourselves to clean up this pattern in the future--partially initialized data is brittle.
1423534_13,,,,,,,This is something we can revisit when we collapse all of the permissions catalogs into the master catalog which you are creating.
1423534_14,,,,,,,"Don't worry, that's another project and not part of the sequence generator work."
1423534_15,,,,,,,"SYSSEQUENCESRowFactory

o I think that you should flip the order of the keys in the second index."
1423534_16,,,,,,,"That is, the key order should be ( schemaID, sequenceName ) rather than ( sequenceName, schemaID )."
1423534_17,,,,,,,This will speed up the check in DataDictionaryImpl.isSchemaEmpty().
1423534_18,,,,,,,"But maybe you have a use for an index with key order ( sequenceName, schemaID ) which I'm not seeing."
1423534_19,,,,,,,"If so, then I would recommend adding a third index."
1423534_20,,,,,,,"Note that if you swap the key order, then you will need to make a corresponding change to DataDictionaryImpl.getSequenceDescriptor(String, SchemaDescriptor)


o I think that buildColumnList() should return an array of 10 column descriptors, one for each column in the table."
1423534_21,,,,,,,"See, for instance, the corresponding method in SYSALIASESRowFactory."
1423534_22,,,,,,,"SYSROLESRowFactory

o As with SYSSEQUENCESRowFactory, I think that buildColumnList() should return a larger array, one cell for each column in the table."
1423534_23,,,,,,,"DataDictionary

o The header comment for getPermDescriptor() does not seem to describe the method."
1423534_24,,,,,,,"EmptyDictionary

o I think that you can remove the stub for dropSequenceDescriptor(String, TransactionController) because you have removed this method from the DataDictionary interface."
1423534_25,,,,,,,"DataDictionaryImpl

o The header comments on getUncachedPermDescriptor() getPermDescriptor(), and dropAllPermDescriptors() look like they were copied from pre-existing methods, so they should be revised to describe the new methods."
1423534_26,,,,,,,"Thanks,
-Rick
"
425267_1,,,,,,,See previous comments for earlier commit.
425267_2,,,,,,,"This one fixes the end-date issue in the comment bean classes:
URL: http://svn.apache.org/viewvc?rev=782269&view=rev

And that resolves this issue in the trunk."
425267_3,,,,,,,"Thanks Greg!
"
688399_1,,,,,,,"Hey Chris,you just moved the files right?!"
688399_2,,,,,,,"Vinicus patch only includes a single file (the failing junit), all Uwe need to do is to apply the patch to the moved file, is that correct?"
21301_1,,,,,,,Also applies to the 4.x series
1946907_1,,,,,,,The behaviour still occurs in the last snapshot using both Mojarra 2.1 or MyFaces.
1946907_2,,,,,,,Attribute 'width' works fine.
1014458_1,,x,,,,,"Nice feature, lars!!"
1014458_2,,,,,,,"Would be nice to have a batch/list functionality as well, like we have for deletes/puts."
1014458_3,,,,,,,Are there any (future?)
1014458_4,,,,,,,plans to have a multi- version of the atomicMutation?
480162_1,,,,,,,It looks like the problem originates in PDFBOX-11.
480162_2,,,,,,,"Many CID mappings are expressed as ranges, which the code explodes into individual Integer->String pairs."
480162_3,,,,,,,This causes pretty big data structures as many of our CMaps cover 65k possible mappings!
480162_4,,,,,,,We should use a more efficient in-memory representation for such range mappings.
1836207_1,,,,,,,"In the same pc I have a outlook client and It work fine, the problem is with xplanner, how can I  configurate xplanner for send mails ?"
1836207_2,,,,,,,Thanks
2516675_1,,,,,,,"ok, I'm looking into this."
280697_1,,,,,,,Okay reviewed and tested patch with sqlite3 and bdb on trunk.
280697_2,,,,,,,One minor correction to configure without sqlite3.
280697_4,,,,,,,#NAME?
2192201_1,,,,,,,Have a look at hibernate.common.xml
412291_1,,,,,,,"Hi David,

This helps me understand what you were talking about - thanks!"
412291_2,,,,,,,"(Things weren't as clear at 2am ;))  

Yes, we should probably definitely be removing the ThreadLocal entirely."
412291_3,,,,,,,I'll make those changes as soon as I can.
412291_4,,,,,,,#NAME?
766227_1,,,,,,,Patch applied in trunk.
766227_2,,,,,,,I have added some buttons to help put variables and patterns.
766227_3,,,,,,,Thank you for your contribution.
