id,love,joy,surprise,anger,sadness,fear,comment
581894_1,,,,,,,"[~bmahler], it looks like this can be closed since the Python UI is gone."
581894_2,,,,,,,Is that true?
1954699_1,,,,,,,seems this is a CDK issue
2389859_1,,,,,,,"Mladen, any progress please?"
2389859_2,,,,,,,I am transfering my issues so I want to know the current status.
2099735_1,,,,,,,Thanks for reporting.
2099735_2,,,,,,,Fixed on the master (0d43528e) and the 1.6 (9affb57a).
1007616_2,,,,,,,or someother version?
1014746_1,,,,,,,"ThriftServer.java and Hbase.thrift patched manually, the other files generated using thrift-0.2.0"
1526597_1,,,,,,,I drafted a small benchmark (so far only for android) to demonstrate the issue.
1202770_1,,x,,,,,"> - FOUserAgent.getStream() is cool and very easy to use (now that it's properly
> documented)."
2042158_1,,,,,,,Does it solve your issue ?
1394527_1,,,,,,,"I'll see if I can arrange for the manifest to contain bundle-manifestVersion.
"
2464241_1,,,,,,,Pushing non-critical issues to the next CR2.
391418_1,,x,,,,,"i kinda like the black acctually .. but that may largely be due to my prefering the ""fire"" solr logo over the futuristic magnifying glass (the red/orange contrasts nicely with the black/grey.

to my mind, the ""Solr"" ""Sun"" connection has allways been really cool ... "
2464241_2,,,,,,,"If you think they are critical for CR1, please re-schedule them."
1045715_1,,,,,,,Issue is reproducible at least on Debian 32bit and SLES 10 64bit.
1016156_1,,x,,,,,Awesome discussion.
2355183_1,,,,,,,"So, I also can say ""this is not yield keyword specific problem""."
2355183_2,,,,,,,Thank you for reviewing.
1910259_1,,,,,,,fixed in revision 478248
1878268_1,,,,,,,pushed
2016201_1,,,,,,,Supported by external project
696242_1,,,,,,,"And in that case, the first argument could also be changed from OpenBitSetDISI to OpenBitSet."
423201_1,,,,,,,"Until there will be _real_ need of adding new Monoid implementations, I would suggest to postpone the problem and keep *your* version of the patch."
423201_2,,,,,,,"Let's fight with the right weapons when we need, I wouldn't use a katana to kill a fly (unless I am Bruce Willis and I'm in Pulp Fiction :P)

best and thanks!"
1920135_1,,,,,,,No issue found after noting how it's invoked.
501431_1,,,,,,,And interestingly suddenly this is moved from MAPREDUCE to OOZIE.
1080884_1,,,,,,,Running patch through hudson.
829006_1,,x,,,,,"Got it, thanks for the explanation."
432408_1,,,,,,,A new issue (https://issues.apache.org/jira/browse/RAMPARTC-140) is created for implementing SupportingToken assertion.
962692_1,,,,,,,v1 fixes the nit
470394_1,,,,,,,Patch committed.
470394_2,,,,,,,Thanks Ankit!
1358709_1,,,,,,,"Thanks for the patch, Kim."
1358709_2,,,,,,,I will look at those remaining references to NATIVE::LOCAL in the error messages.
1358709_3,,x,,,,,The patch looks good.
1358709_4,,,,,,,"I tripped across one puzzling sentence, but it wasn't something that you changed: In the second, longer paragraph of the BUILTIN bullet, we recommend LDAP and user-supplied schemes as alternatives to BUILTIN, but we don't recommend NATIVE."
1358709_5,,,,,,,Did we decide to not recommend NATIVE here or should this be adjusted to include it beside the other safe schemes?
1358709_6,,,,,,,Thanks.
2415951_1,,,,,,,It could be that this has been resolved already (elsewhere).
1589002_1,,,,,,,See attached patch.
1589002_2,,,,,,,I'll add docs in Confluence if the example is integrated in Camel's codebase.
1347060_1,,,,,,,Closing all issues created in 2005 and before which are marked resolved
1353385_1,,,,,,,APIs doc is outdated - thanks
1326896_1,,,,,,,"I have committed a fix for this, please close if you are satisfied."
1326896_2,,,,,,,Thanks.
1034440_1,,x,,,,,Cool cool - thanks stack!
1125251_1,,x,,,,,Awesome! This tool is cool.
924046_2,,,,,,,What % of clients do think were stuck like this?
954497_2,,,,,,,Mind adding your test run results in here?
954497_3,,,,,,,QA test result is recorded above.
2483856_1,,,,,,,"Closing, works like charm now."
2483856_2,,x,,,,,Thanks guys for saving mankind!
2332982_1,,x,,,,,This looks safe also
368838_1,,,,,,,Stefan: are you sure you had a clean build with my patch applied?
2095235_1,,,,,,,Please follow up on the forum: http://www.jboss.com/index.html?module=bb&op=viewtopic&p=4178893#4178893
2006746_1,,,,,,,suggested for 3.1.1
876443_1,,,,,,,Might want to correct the misspelling: *remvoed* AllFromInodesFromMap :)
411954_1,,,,,,,Thank you very much Les.
411954_2,,x,,,,,I've just tested the shiro trunk with karaf-2.2 release and everything works fine :)
2114393_1,,x,,,,,Pretty sure this was fixed by the time we released JRuby 1.6.
310717_1,,,,,,,This patch looks pretty good.
310717_2,,,,,,,"I think we should apply it.


"
2369355_1,,,,,,,Moved to GA.
2449525_1,,,,,,,"This appears to be a issue with Hibernate (the default JPA implementation in JBoss AS) rather than a EJB3 issue.
"
614426_2,,,,,,,Fixed the MAPREDUCE-3028 commit which broke MR1.
614426_3,,,,,,,Contributed by Hitesh Shah.
1836807_1,,x,,,,,"Interesting, I just replaced my src with the latest in the trunk and did a compleatly clean build and the problem seems to have gone away."
1836807_2,,,,,,,I'll close the ticket as it looks like a non-issue.
861953_2,,,,,,,"* it is impossible to name a column 1
* it is impossible to name a column alias 1

If order by supports this I do not see group by can't?"
861953_3,,,,,,,"Do we want to reconsider this?I kinda like the feature.
"
2047189_1,,,,,,,no POM provided here
364849_1,,x,,,,,This is Awesome Stefan - thanks a million!
242158_1,,x,,,,,This is awesome - works in a one-liner. 
411660_2,,,,,,,I resolved the issue via Spring.
1338828_1,,,,,,,This is a screenshot from 1.5.3 and that is how I would expect the Directory Studio to behave.
1675900_1,,,,,,,"Harsh, will you have a chance to work on a test for this?"
1675900_2,,,,,,,Please tell me if you'd like me to help.
2220965_1,,,,,,,"Misty,  Can you move JBPAPP-7480 to bz and then cross reference the bz number in this Jira and close this one?"
2220965_2,,,,,,,"Thanks,

Mike"
1546239_1,,,,,,,"v3 rewritten to be lots more explicit and save the vendor, arch, and version numbers for later code to use."
1577629_2,,,,,,,"patch by johano; reviewed by jbellis for 
"
666093_1,,x,,,,,Awesome!
666093_2,,,,,,,We just need a possible mentor here... volunteers...?
2309521_1,,,,,,,EAR project case is fixed.
2309521_2,,,,,,,"Alexey, please verify."
2118679_1,,,,,,,Resolving this issue as it is covered by JBQA-5191 and JBQA-5192.
2064934_1,,,,,,,"btw, MCLEAN-18-maven-clean-plugin.patch also applied the maven-clean-plugin-dcabasson-MCLEAN17.txt fix."
2431973_1,,,,,,,"> DistributedHashTable is a good solution but then how are we planning 
> to acheive let say a Distributed LRU Cache or Distributed Time-limited 
> or a Distributed Count-Limited Cache."
2431973_2,,,,,,,"I am not mandating to use DistributedHashtable directly by plugging it into
Castor as it is, but as the base for 'distributable' TimeLimited, CountLimited
et alias cache implementations."
1862171_1,,x,,,,,"Nice, I did not think about using the system tables."
1862171_2,,,,,,,I will re-work and submit another patch.
1546890_1,,,,,,,Will upgrade to 1.0.10 and check it.
1546890_2,,,,,,,Will re-enable assertions too.
584745_1,,,,,,,{{TrivariateRealFunction}} renamed in r1236932.
2114722_1,,,,,,,"yeah, I think so."
2114722_2,,,,,,,we just used it with CBR (content based routing).
2114722_3,,,,,,,Now the JBossESB changed to SwitchYard and we need to ensure it works.
1458817_1,,x,,,,,"You're results are awesome Paul. Great work :)
Looking forward to see your new JSON parser in trunk whenever you think is ready."
2277576_1,,,,,,,We are restructuring the trunk now from jboss as 4.2 and it's unstable.
2277576_2,,,,,,,You should check out and build revision 693 of the trunk.
1876165_1,,,,,,,pushed
1925418_1,,,,,,,It is not in the requirement.
1925418_2,,,,,,,I move it into 2.1-M1.
1116180_1,,,,,,,Attaching patch for review.
646632_1,,x,,,,,"Awesome, you rock, Drew!"
646632_2,,x,,,,,Very cool.
1870702_1,,,,,,,"Resolved by changing the meaning of maxRows to be across all code tables with a default of 200000, introduced maxRowPerTable with a default of 10000 to take the place of maxRows, and upped the default for maxCount to 200."
2134769_1,,,,,,,I switched to using the JavaSourceLoader and this appears to work fine.
2143498_1,,,,,,,Done except for pages.xml imports.
1886435_1,,,,,,,"I'm not sure if this is actually a bug, we had it fixed, but then had to revert it."
1886435_2,,,,,,,I don't remember why right now though.
678908_1,,x,,,,,Awesome speedup! Finally all this work shows great results!!
1578580_1,,,,,,,"Integrated in Cassandra #63 (See [http://hudson.zones.apache.org/hudson/job/Cassandra/63/])
    "
1042898_1,,,,,,,Applied Andrew's patch at r676866.
1042898_2,,,,,,,Please check that it was applied as expected.
1008127_1,,x,,,,,"@Subbu:
Glad I was able to help."
1008127_2,,,,,,,I think nothing is absolute.
1008127_3,,x,,,,,I believe in relativity :-)
1838332_1,,,,,,,This appears to have been fixed
1021811_1,,x,,,,,Great! It's been good to be able to contribute and I hope to be able to more for this awesome project when I have the spare time.
763414_1,,,,,,,and your comments are very welcome..
1502391_1,,,,,,,"Marcus 

we need a fix for this - if you can check in we will test it

thanks
/sudha"
1109374_2,,,,,,,Add CRC32C as another DataChecksum implementation.
1109374_3,,,,,,,Contributed by Todd Lipcon.
1749686_1,,,,,,,Not a SWF issue.
1749686_2,,,,,,,Please open with Spring Framework.
2497918_1,,,,,,,Issue is also present at JPP 6.0 ER02
1620033_1,,,,,,,Fixed with revision 164512.
2453740_1,,,,,,,Added org.jboss.test.ejb3.war.deployment.unit.Ejb3WarDeploymentTestCase in r99656.
358347_1,,,,,,,"Also see issues like SOLR-2608 that are ignored, i've been running lucene tests in a loop on and off for periods, and basically gave up on solr tests aswel, they randomly fail all the time"
994958_2,,,,,,,This one... Really.
656966_1,,x,,,,,Thanks Uwe!
947452_1,,,,,,,"Alright, I'll put this and HBASE-8453 in through trunk today."
778200_1,,,,,,,"Sorry, I realise now that ""does not work"" was insufficiently specific."
1345456_1,,,,,,,Seems to be working just fine.
671581_1,,x,,,,,Code looks cool.
1035173_2,,,,,,,It looks pretty bad.
2281006_1,,,,,,,[~maxandersen] please review
2448836_1,,,,,,,Corrected error in comment - please use this one.
936520_1,,,,,,,"hbase org.apache.hadoop.hbase.PerformanceEvaluation --nomapred --rows=250000 randomRead 16

10k regions, 5 RS."
936520_2,,,,,,,I tested HBASE-9609 and it does seem to make a huge difference!
428835_1,,x,,,,,Cool - good information to have.  Thanks Lance!
2110584_1,,,,,,,"I integrated the submitted patch in the new JBW, but did not really test it."
2110584_2,,,,,,,"Nobody has complained about it yet, but I don't think it should be ported to older versions at this time."
2480649_1,,,,,,,[~saturnism] agreed.
896857_1,,,,,,,# Javadoc in InterDatanodeProtocolServersideTranslator refers to JournalProtocl.
2461027_1,,,,,,,Shelly use JBAS-5873 for the matrix tests :)
1112489_1,,,,,,,"Sanjay, your patch is missing the AuthenticationFilterInitializer.java file"
1342353_1,,,,,,,"The pb is not in ApacheDS, but in the startup delay."
1532029_1,,x,,,,,Hey very cool. 
1680856_2,,,,,,,"Thanks,
Raymond"
2383572_1,,,,,,,I'll try it on our Fedora.
1210594_1,,,,,,,"Hi guys,

I agree 100% on this."
1210594_2,,,,,,,"Just a note, there was a long conversation about this here: https://reviews.apache.org/r/4655/ and this is a dup of FLUME-1089."
654410_1,,x,,,,,"Hi, very cool!"
654410_2,,x,,,,, I like the elegant parser!  
1609815_1,,,,,,,"Based on review comment, add ""respBody.hasPublishResponse()"" before returning respBody.getPublishResponse()"
149704_1,,,,,,,using g++ (GCC) 4.1.2 20080704 (Red Hat 4.1.2-48) and cppunit 1.12.1.
216370_1,,,,,,,"Next try,
r1475799 in santuario."
643278_1,,,,,,,Here's a patch that adds in support for SGD.
1950335_1,,,,,,,Fixed in trunk -r746186.
858038_1,,,,,,,"Carl, can you review?
"
2059930_1,,,,,,,I haven't fully grok'd the entire issue yet but have a quick comment: 2.0 was released several months ago...it's not 2.0-alpha-5-SNAPSHOT.
2379571_1,,,,,,,is it essue still open?
662713_1,,x,,,,,Thanks for fixing it so quickly!
2120024_1,,,,,,,Bozhidar: I agree with your assessment.
2120024_2,,x,,,,,Jonathan: over to you :)
1274036_1,,,,,,,"On 2008-04-03 15:57:26.514 laupark commented:
Opened."
1274036_2,,,,,,,"On 2008-04-04 13:31:57.627 jimurphy commented:
fixed rev."
1274036_3,,,,,,,"196883
On 2008-04-08 08:38:58.599 wichan commented:
Still couldn't find the swfUtils.jar in the webtier.war ad flex-for-cf.zip
On 2008-04-09 07:51:01.799 ccreanga commented:
Fixed - swfutils.jar was not included in the war"
1341696_1,,,,,,,The code should work.
1341696_2,,,,,,,The API need to be checked and those errors (ie PDU has been fully decoded ...) have to be fixed.
1341696_3,,,,,,,We wil investigate what's going on.
1341696_4,,,,,,,Thanks for the report !
2300422_1,,,,,,,This patch should do the trick.
297166_1,,x,,,,,"Cool, looks good."
2300422_2,,,,,,,A test case is needed too
1966708_1,,,,,,,"I suggest, that you have a closer look at the exception."
1966708_2,,,,,,,The absolut portion of the path *is always prepended*.
922791_1,,x,,,,,Cool. sounds good to me.
1966708_3,,,,,,,So any of your suggestions do not help.
1827415_1,,,,,,,Assume closed as resolved and released
1791300_1,,,,,,,PR https://github.com/SpringSource/spring-integration/pull/621
920545_1,,x,,,,,"Hi Carlos, This looks awesome! Lots of cool stuff."
1375548_1,,,,,,,I committed patch _c with revision 697897.
1375548_2,,,,,,,"Note, that as indicated before, JVMInfo still is part of derbyclient.jar (I assume because of the need to support sysinfo)."
626247_1,,,,,,,Committed to trunk and 0.21 branch.
626247_2,,,,,,,Thanks Amar!
820038_1,,,,,,,An awesome feature of Hive is the rich type system with excellent support for complex data-structures.
349941_1,,x,,,,,"Waaaaay cool! I especially like the ""upload file"" option."
1782818_1,,,,,,,"Solomon,
That is very slick."
1782818_2,,,,,,,I tested it and it works fine.
1782818_3,,,,,,,Thank you.
1782818_4,,,,,,,"Chris,
This might be a useful technique to add to the documentation or to a HOWTO on the SJC wiki (when / if there is one)

Thanks all."
729628_1,,,,,,,Committed after fixing the typo.
857455_1,,,,,,,One minor point - can you make result a member variable of GenericUDFArrayContains?
857455_2,,,,,,,This will reduce object creation.
857455_3,,,,,,,"The patch needs to be regenerated against the current trunk, but otherwise looks good."
580447_1,,x,,,,,"cool stuff! a good candidate to put on myfaces-commons-utils, so the user can just add the resource handler on its webapp faces-config."
1358696_1,,,,,,,"Thanks, Kristian."
1358696_2,,,,,,,Committed revision 1341814.
2087167_1,,,,,,,Deleted spurious 'Added: svn:executable' from the patch.
1921841_1,,,,,,,"The .md extension is used for the readme because it's in MarkDown format, used by GitHub."
1921841_2,,,,,,,"See the following page for an example:

https://github.com/seam/examples/tree/master/booking"
2413399_1,,,,,,,"It is completely expected an updatesite.zip for all of devstudio is *bigger* than the installer.jar
"
795315_1,,,,,,,"I presume so.

"
639900_1,,,,,,,"updating, minor errors in pdf doc"
2545827_1,,,,,,,Yup instruction are not correct.
307058_1,,,,,,,"""That said, check out setReadLength in TBinaryProtocol."""
1111284_1,,,,,,,I have committed this.
1111284_2,,x,,,,,"Thanks, Daryn!"
1111284_3,,,,,,,Also thanks Matt for the review.
2128831_1,,,,,,,"Yup, I'll get it in today."
2133916_1,,,,,,,Fixed in r544
416543_1,,,,,,,"Yeah, it looks like there are conflicts with RenderingContentRewriter and one of the guice modules."
939944_1,,,,,,,Committed to Trunk.
939944_2,,x,,,,,Thanks for the reviews..
2293268_1,,,,,,,Atlassian 3.2 is in Central.
532960_1,,,,,,,Missfire
919520_1,,x,,,,,"Wow, thanks Raghu, that's awesome and will save me a ton of time. "
2078947_1,,,,,,,"closed with no testing, Ian says this is a code-level change."
1941338_1,,,,,,,"When the order of methods change, so the rendering of fragments is bellow the definition, then it works fine."
1965311_1,,,,,,,Two git commits included.
711469_1,,,,,,,Abandoned; no longer necessary.
1455020_1,,x,,,,,"So very cool, and so very committed-- thanks Matthias, this is awesome."
1169934_1,,x,,,,,"Took me a few seconds to get it, but then I realized how awesome it is.  "
1169934_2,,x,,,,,"I'm happy to use it as the standard logo (i.e. website, etc.)."
1064705_2,,,,,,,"I'm giving this up hoping someone confident in Swing would look into it. 
"
723757_1,,,,,,,Have you been able to work on that ?
723757_2,,,,,,,Do you need any help?
2441539_1,,,,,,,"Hi Matt,

Thank you for fixing this issue."
2441539_2,,,,,,,I will use it when it will be included in a future release.
967366_1,,,,,,,Committed the addendum in revision 1414868.
1776212_1,,,,,,,Thanks for pointing out this (rather embarrassing) oversight!
1776212_2,,,,,,,Fixed for both 2.0 M4 and 1.2.8.
1649226_1,,,,,,,"Amila,
Could you please check my fix?"
1649226_2,,x,,,,,"http://svn.apache.org/viewvc?view=rev&revision=468444

Deepal,
Thanks!"
448659_1,,,,,,,"Hi Drew,

I have upgraded Postage to James3 (see POSTAGE-23) and used your patch at this occasion."
1597712_1,,x,,,,,Awesome stuff Stephen! 
1648457_1,,,,,,,Looks like we have already taken care of this.
256481_1,,,,,,,are any changes needed to dd2spring for this?
1982039_1,,,,,,,I suggest making a tooltip with the title of the context help article (a popup)  when the user hovers the question mark icon.
1920925_1,,,,,,,"We'll go with this for now, thanks for the fix!"
912375_1,,,,,,,Ran some benchmarks.
912375_2,,,,,,,"When the modulus is large, which means that number of collisions is small, LightWeightGSet is much better than GSetByHashMap."
254374_1,,,,,,,added fixVersion
2274367_1,,,,,,,Rolled over to 0.5.5 to get a stable JavaOne release out
1379656_1,,,,,,,"Can you expand on the difference between a Prepared Statement and
a Logical Prepared Statement?"
1379656_2,,,,,,,"And also on the difference between a
Connection and a Logical Connection?"
1379656_3,,,,,,,"Are these already-existing
concepts in the client?"
1379656_4,,,,,,,Or did you introduce these concepts?
1379656_5,,,,,,,"Thanks!
"
1064678_1,,x,,,,,"Thanks Alexei, the patch is fine.
"
2026908_1,,,,,,,how does your application.cfc looks like (ormsettings)?
2023723_1,,,,,,,I think Jason has done this already?
1036613_1,,,,,,,canceling
660369_1,,x,,,,,"Awesome co-op. Thanks, Robert & Mike, for picking this up."
2367838_2,,,,,,,We'll take a look for 1.21.
903979_1,,,,,,,"Thanks Matt, Todd and Cos!"
976523_1,,,,,,,"From https://builds.apache.org/job/PreCommit-HBASE-Build/2581/console, it is not clear which test hung."
1593541_1,,,,,,,Committed the patch with thanks to Christian.
1081362_1,,,,,,,"Sangwon Seo, Thanks for your review."
1081362_2,,,,,,,"Could you give me more comments?
"
2027278_1,,,,,,,fixed.
2027278_2,,,,,,,This obsoletes ~/.m2/maven.properties
2465701_1,,,,,,,The last bug I see mentioning a HSQL upgrade was JBAS-1618 which ended up with 1.8 RC9.
2465701_2,,,,,,,"However, this bug mentions that we were upgrading from 1.8.0.2 to 1.8.0.7."
2465701_3,,,,,,,When did 1.8 RC 9 get upgraded and where is it tracked/documented?
1840015_1,,,,,,,Done in Weld and TCK
1659348_1,,,,,,,Applied patch.
1659348_2,,,,,,,Thanks.
577184_1,,,,,,,And many thanks to you Olivier for applying this so quickly!
577184_2,,x,,,,,Cheers!
1169132_1,,,,,,,quick patch.
2538101_1,,,,,,,What's the operation?
604592_1,,,,,,,I just committed this to trunk and branch-0.23.
604592_2,,,,,,,Thanks Sid!
30489_1,,,,,,,"Thanks for testing, but please don't close it yet."
441965_1,,,,,,,Fixed; trunk r910567
569640_1,,,,,,,For _ExternalSpecifications there is already an issue in the JIRA: MYFACES-2582
6331_1,,,,,,,Thank you.
6331_2,,,,,,,Issue has been resolved.
1466579_1,,,,,,,A new patch including some corrected Japanese sentences and a link to Solr Wiki.
1847364_1,,,,,,,All log statements should now be surrounded by log guards.
2053349_1,,,,,,,"Horia Chiorean <hchiorea@redhat.com> made a comment on [bug 1014709|https://bugzilla.redhat.com/show_bug.cgi?id=1014709]

https://github.com/jboss-integration/modeshape/commit/d1d97180c957491bee3654743ebd4a6860314ad3"
2481795_1,,x,,,,,Thanks Galder:)
886160_1,,x,,,,,"Daryn, the current patch looks good."
886160_2,,,,,,,Thanks!
2466250_1,,,,,,,Used the new attribute to move ObjectStoreDir from bin to server/xxx/data/tx-object-store
490723_1,,,,,,,Please also see Glassfish issue 13111: https://glassfish.dev.java.net/issues/show_bug.cgi?id=13111
1609085_1,,,,,,,Committed as r1382016.
1609085_2,,,,,,,Thanks Sijie.
2459016_1,,,,,,,"Joram, notify Jennifer Vennable when you completed this."
1468735_1,,,,,,,"Never mind, found it."
1468735_2,,,,,,,Changes applied in revision 1369338.
1468735_3,,,,,,,Many thanks.
1922211_1,,,,,,,Monitor no longer based on protobuf.
1827379_1,,,,,,,"periodic bulk close of resolved issues.
"
218222_1,,,,,,,Thank you!
218222_2,,,,,,,It's working like a charm.
886802_1,,,,,,,The b-1.0 patch also applies to branch-1.
2059249_1,,x,,,,,Sounds good.
2059249_2,,,,,,,I too have been busy on other projects.
2059249_3,,,,,,,I'll try and test with queryIndexesRebuiltSynchronously false today.
1602017_1,,,,,,,fancy applying this patch before 1.3.0?
405597_1,,,,,,,applied patch (thanks) in r1055887
1827876_1,,,,,,,"Hi Jaikiran, 

Didn't you already fix this one?"
968616_1,,,,,,,Thanks!
1667340_1,,,,,,,"Dona, Thiru: can one of you (or anyone else) please review this?"
1045150_1,,,,,,,05 was committed in r613384
2327124_1,,,,,,,committed to TRUNK (m3)
2545846_1,,x,,,,,This is awesome!
966178_1,,x,,,,,v2 Looks good to me.
2050066_1,,,,,,,applied.
2050066_2,,,,,,,Thanks!
513057_1,,,,,,,"Closing this issue, Jacopo fixed it at r1345528."
513057_2,,,,,,,Thanks Jacopo.
1124596_2,,,,,,,Add EnumSetWritable.
1124596_3,,,,,,,"Contributed by He Yongqiang
"
1780034_1,,,,,,,"I'm closing this for the time being, as we've reopened SPR-368."
913651_1,,,,,,,Applied Rodrigo's suggestions
1436615_1,,,,,,,This was found in via JBossWS CXF so once we've pulled it in to JBoss and tested I'll let you know if there's any issues.
1436615_2,,,,,,,Thanks for the quick response Colm.
790615_1,,,,,,,Hullo?
2025362_1,,,,,,,"Could you open a ticket for this (last comment)
Tnx micha"
2466754_1,,,,,,,"Hi Thomas, it's here:

https://svn.jboss.org/repos/common/common-old/branches/Branch_1_0/"
2354572_1,,x,,,,,"Hey, you're right, that idea was probably not the best approach to the problem - 0.6 looks really nice, looking forward to it :)"
1776805_1,,,,,,,Indeed!
1776805_2,,,,,,,This is actually the case in 2.0.5 already.
1776805_3,,,,,,,"Thanks for spotting this, Philipp!"
907912_1,,,,,,,It seems that using {{BufferedOutputStream}} is a better solution since it will also help other operations.
907912_2,,,,,,,"BTW, do you know why there are four one-byte packets?"
889230_1,,,,,,,fixed style
1549909_1,,,,,,,Dupe of CASSANDRA-4042 (we'll include the BF fp change there)
2043022_1,,,,,,,"I think this looks like the same issue as  [MFINDBUGS-55|http://jira.codehaus.org/browse/MFINDBUGS-55]

Garvin "
1093135_2,,,,,,,Changed contributed by from Arpit Agarwal to Arpit Gupta.
1093135_3,,,,,,,"(Revision 1450575)
HADOOP-8917."
1093135_4,,,,,,,add LOCALE.US to toLowerCase in SecurityUtil.replacePattern.
1093135_5,,,,,,,Contributed by Arpit Agarwal.
2271434_1,,,,,,,"Marc, you're re-logging your ownn issues :)"
1569713_1,,,,,,,Patch now applies cleanly against latest version of trunk.
2123473_1,,,,,,,Bounce to Doug as this is a SOA issue.
701054_1,,,,,,,"Thanks, I just committed the patch."
701054_2,,,,,,,"However, I cannot see errors in lucli, can you make a patch for those cases, too?
"
1969320_1,,x,,,,,Thanks for moving so quickly on this guys.
1969320_2,,,,,,,Look forward to seeing it resolved in 3.3.2.GA!
977198_1,,,,,,,"On trunk apparently all use of the ""get"", ""put"", and ""delete"" histograms have already been removed from the regionserver, except for the Jamon templates."
977198_2,,,,,,,Since an approach to put back two such HRegionInterface level measurements with a query/mutate distinction has been +1ed on this issue I'm going to put them back on trunk and port back the changes to 0.94.
977198_3,,,,,,,Calling them queryRequestLatency and mutateRequestLatency in RegionServerMetrics.
2486241_1,,,,,,,"This blog post speaks briefly about colocation, and how this can be achieved using AtomicMaps."
902763_1,,,,,,,Thanks Daryn!
902763_2,,,,,,,for taking a look.
1157923_1,,,,,,,I just committed this.
1157923_2,,x,,,,,"Thanks, Sanjay!"
299082_1,,,,,,,#NAME?
2426284_1,,,,,,,After several retries seems we are unable to proceed with releng team to get supported solution.
2426284_2,,,,,,,Will setup mirroring to Brno QA lab.
175864_1,,,,,,,Thanks Claus.
175864_2,,,,,,,If somebody can better formulate my above fragment and place it somewhere in wiki it would be great.
175864_3,,,,,,,"I have throuroughly documented this in the XWorkConverterTest, see testStringToInt, testStringToInteger, testStringToPrimitiveDouble and testStringToDouble."
175864_4,,,,,,,If you feel like adding this to the showcase than go on.
175864_5,,,,,,,"cheers,

./alex
--
.w( the_mindstorm )p.
"
780721_1,,x,,,,,"Cool, thanks Daniel, we're actually cool with either updating it to e9ff8c4928 or flipping the write bit and we'll push the delta ourselves - whatever's the fastest to get to writeable:)

Thanks,
--tim"
805064_2,,,,,,,I think the HttpClients service interface must be exported for it to be used.
805064_3,,,,,,,On the other hand the BundleActivator should not be exported and can as well be moved to the osgi.impl package.
2046200_1,,,,,,,Done at revision 1582 - 1585
1002038_1,,,,,,,Closing as fixed in trunk.
